{"arms":["A_direct_reads","B_existing_memory","C_memory_candidate_index"],"authorized_egress_policy_hash":"8888888888888888888888888888888888888888888888888888888888888888","benchmark_id":"benchmark_01","content_hash":"21d0d72067f6f180a83aac8ccf71185a13e19c8a8804186c53866d54f8f42886","format":"world-forge.codebase_memory_benchmark_plan","format_version":1,"gates":{"full_net_token_reduction_basis_points":3000,"maximum_critical_omissions":0,"maximum_incremental_p95_ms":5000,"maximum_quality_loss_basis_points":200,"require_tree_unchanged":true,"require_zero_unauthorized_egress":true,"structural_net_token_reduction_basis_points":5000},"latency_percentile_method":"nearest_rank","source_binding":{"checkout_id_hash":"3333333333333333333333333333333333333333333333333333333333333333","revision":"83efe261faf2ed3309da2ae66da20755d96f16df","tree_hash":"2222222222222222222222222222222222222222222222222222222222222222"},"task_set":[{"category":"structural_navigation","repetitions":1,"rubric_hash":"5555555555555555555555555555555555555555555555555555555555555555","task_id":"navigation_01","task_spec_hash":"4444444444444444444444444444444444444444444444444444444444444444"},{"category":"other","repetitions":1,"rubric_hash":"7777777777777777777777777777777777777777777777777777777777777777","task_id":"other_01","task_spec_hash":"6666666666666666666666666666666666666666666666666666666666666666"}],"token_accounting_version":"net_tokens_v1","tree_guard_policy_hash":"9999999999999999999999999999999999999999999999999999999999999999"}
